root@comp3134-winter-2025-intro-to-cyber-security:~# tcpdump -i eth0 tcp
tcpdump: verbose output suppressed, use -v[v]... for full protocol decode
listening on eth0, link-type EN10MB (Ethernet), snapshot length 262144 bytes
00:08:53.823446 IP comp3134-winter-2025-intro-to-cyber-security.ssh > 162.243.190.66.48710: Flags [P.], seq 3124042566:3124042694, ack 233148114, win 501, options [nop,nop,TS val 3015389645 ecr 3415833158], length 128
00:08:53.823532 IP comp3134-winter-2025-intro-to-cyber-security.ssh > 162.243.190.66.48710: Flags [P.], seq 128:192, ack 1, win 501, options [nop,nop,TS val 3015389645 ecr 3415833158], length 64
00:08:53.823587 IP comp3134-winter-2025-intro-to-cyber-security.ssh > 162.243.190.66.48710: Flags [P.], seq 192:272, ack 1, win 501, options [nop,nop,TS val 3015389645 ecr 3415833158], length 80
00:08:53.823632 IP comp3134-winter-2025-intro-to-cyber-security.ssh > 162.243.190.66.48710: Flags [P.], seq 272:352, ack 1, win 501, options [nop,nop,TS val 3015389645 ecr 3415833158], length 80
00:08:53.823696 IP comp3134-winter-2025-intro-to-cyber-security.ssh > 162.243.190.66.48710: Flags [P.], seq 352:496, ack 1, win 501, options [nop,nop,TS val 3015389645 ecr 3415833158], length 144
00:08:53.825417 IP 162.243.190.66.48710 > comp3134-winter-2025-intro-to-cyber-security.ssh: Flags [.], ack 128, win 501, options [nop,nop,TS val 3415833166 ecr 3015389645], length 0
00:08:53.825417 IP 162.243.190.66.48710 > comp3134-winter-2025-intro-to-cyber-security.ssh: Flags [.], ack 192, win 501, options [nop,nop,TS val 3415833166 ecr 3015389645], length 0
00:08:53.825417 IP 162.243.190.66.48710 > comp3134-winter-2025-intro-to-cyber-security.ssh: Flags [.], ack 272, win 501, options [nop,nop,TS val 3415833166 ecr 3015389645], length 0
00:08:53.825496 IP 162.243.190.66.48710 > comp3134-winter-2025-intro-to-cyber-security.ssh: Flags [.], ack 352, win 501, options [nop,nop,TS val 3415833166 ecr 3015389645], length 0
00:08:53.825496 IP 162.243.190.66.48710 > comp3134-winter-2025-intro-to-cyber-security.ssh: Flags [.], ack 496, win 501, options [nop,nop,TS val 3415833166 ecr 3015389645], length 0
00:08:53.925072 IP comp3134-winter-2025-intro-to-cyber-security.42628 > 67.207.67.3.domain: Flags [S], seq 3935866854, win 64240, options [mss 1460,sackOK,TS val 2055018146 ecr 0,nop,wscale 7,tfo  cookiereq,nop,nop], length 0
00:08:53.927622 IP 67.207.67.3.domain > comp3134-winter-2025-intro-to-cyber-security.42628: Flags [S.], seq 1580843206, ack 3935866855, win 65160, options [mss 1460,sackOK,TS val 2254961264 ecr 2055018146,nop,wscale 9], length 0
00:08:53.927658 IP comp3134-winter-2025-intro-to-cyber-security.42628 > 67.207.67.3.domain: Flags [.], ack 1, win 502, options [nop,nop,TS val 2055018148 ecr 2254961264], length 0
00:08:53.927938 IP comp3134-winter-2025-intro-to-cyber-security.42628 > 67.207.67.3.domain: Flags [P.], seq 1:48, ack 1, win 502, options [nop,nop,TS val 2055018149 ecr 2254961264], length 47 23732+ PTR? 66.190.243.162.in-addr.arpa. (45)
00:08:53.928969 IP 67.207.67.3.domain > comp3134-winter-2025-intro-to-cyber-security.42628: Flags [.], ack 48, win 128, options [nop,nop,TS val 2254961266 ecr 2055018149], length 0
00:08:53.929147 IP 67.207.67.3.domain > comp3134-winter-2025-intro-to-cyber-security.42628: Flags [P.], seq 1:115, ack 48, win 128, options [nop,nop,TS val 2254961266 ecr 2055018149], length 114 23732 NXDomain 0/1/0 (112)